{
  "$schema": "https://json-schema.org/draft/2020-12/schema",
  "$id": "https://aieng.dev/schemas/claim_map.schema.json",
  "title": ".aieng claim map",
  "description": "Maps structured engineering claims to required and actual evidence IDs. Claims without evidence are marked 'unsupported', not false. .aieng records which claims are supported by evidence from external tools.",
  "type": "object",
  "required": [
    "format_version",
    "claim_map_id",
    "claims",
    "claim_policy"
  ],
  "properties": {
    "format_version": {
      "type": "string",
      "const": "0.1.0"
    },
    "claim_map_id": {
      "type": "string",
      "minLength": 1,
      "description": "Stable identifier for this claim map."
    },
    "source_task_id": {
      "type": "string",
      "minLength": 1,
      "description": "Optional: task_id from task/task_spec.yaml if a task spec is present."
    },
    "claims": {
      "type": "array",
      "items": {
        "type": "object",
        "required": ["claim_id", "claim_type", "claim_text", "required_evidence_ids", "actual_evidence_ids", "verification_status"],
        "properties": {
          "claim_id": {
            "type": "string",
            "minLength": 1,
            "description": "Stable identifier for this claim."
          },
          "claim_type": {
            "type": "string",
            "description": "Category of claim. Known values: task/task_defined, handoff/contract_defined, solver/result_available, mesh/evidence_available, geometry/modification_evidence_available."
          },
          "claim_text": {
            "type": "string",
            "minLength": 1,
            "description": "Human-readable description of this claim."
          },
          "required_evidence_ids": {
            "type": "array",
            "items": {"type": "string"},
            "description": "Evidence IDs from evidence_index.json required to support this claim."
          },
          "actual_evidence_ids": {
            "type": "array",
            "items": {"type": "string"},
            "description": "Evidence IDs from evidence_index.json actually present in this package."
          },
          "verification_status": {
            "type": "string",
            "enum": ["pass", "fail", "unsupported", "partially_supported", "needs_review"],
            "description": "Whether this claim is currently supported by evidence. 'unsupported' means no evidence exists yet - not that the claim is false."
          },
          "notes": {
            "type": "string",
            "description": "Optional notes about this claim."
          },
          "decision_criteria": {
            "type": "object",
            "description": "Per-claim thresholds declaring what constitutes sufficient evidence for pass/fail/needs_review. auto_advance must be false to preserve evidence-only policy.",
            "required": ["pass_requires", "auto_advance"],
            "properties": {
              "pass_requires": {"type": "string", "minLength": 1},
              "auto_advance": {"type": "boolean", "enum": [false]},
              "fail_requires": {"type": "string"},
              "needs_review_if": {"type": "string"},
              "unsupported_if": {"type": "string"},
              "note": {"type": "string"}
            },
            "additionalProperties": false
          }
        },
        "additionalProperties": false
      },
      "description": "List of engineering claims and their evidence status."
    },
    "claim_policy": {
      "type": "object",
      "required": [
        "external_tools_execute",
        "aieng_core_generates_solver_evidence",
        "aieng_core_generates_mesh_evidence",
        "aieng_core_modifies_cad_geometry"
      ],
      "properties": {
        "external_tools_execute": {
          "type": "boolean",
          "const": true,
          "description": "Must be true. Solver execution, mesh generation, and CAD modification are performed by external tools only."
        },
        "aieng_core_generates_solver_evidence": {
          "type": "boolean",
          "const": false,
          "description": "Must be false. .aieng core does not run solvers or generate solver evidence."
        },
        "aieng_core_generates_mesh_evidence": {
          "type": "boolean",
          "const": false,
          "description": "Must be false. .aieng core does not generate meshes or mesh evidence."
        },
        "aieng_core_modifies_cad_geometry": {
          "type": "boolean",
          "const": false,
          "description": "Must be false. .aieng core does not directly modify CAD geometry."
        }
      },
      "additionalProperties": false,
      "description": "Claim policy constraints for the claim map. All flags enforce the execution boundary."
    }
  },
  "additionalProperties": false,
  "$comment": "Phase 14C: claim-evidence map. 'unsupported' means no evidence has been attached yet - not that the claim is false or violated. claim_policy const guards enforce .aieng execution boundary."
}
